{"$defs":{"VersionedRef":{"additionalProperties":false,"properties":{"content_hash":{"pattern":"^[0-9a-f]{64}$","title":"Content Hash","type":"string"},"id":{"maxLength":65536,"minLength":1,"title":"Id","type":"string"},"version":{"maxLength":65536,"minLength":1,"title":"Version","type":"string"}},"required":["id","version","content_hash"],"title":"VersionedRef","type":"object"}},"$schema":"https://json-schema.org/draft/2020-12/schema","additionalProperties":false,"properties":{"artifact_proposal_key":{"maxLength":65536,"minLength":1,"title":"Artifact Proposal Key","type":"string"},"attachment_id":{"pattern":"^[0-9a-f]{8}-[0-9a-f]{4}-[0-9a-f]{4}-[0-9a-f]{4}-[0-9a-f]{12}$","title":"Attachment Id","type":"string"},"attachment_sha256":{"pattern":"^[0-9a-f]{64}$","title":"Attachment Sha256","type":"string"},"job_id":{"pattern":"^[0-9a-f]{8}-[0-9a-f]{4}-[0-9a-f]{4}-[0-9a-f]{4}-[0-9a-f]{12}$","title":"Job Id","type":"string"},"logparse_tool_ref":{"$ref":"#/$defs/VersionedRef"},"request_sha256":{"pattern":"^[0-9a-f]{64}$","title":"Request Sha256","type":"string"},"schema_version":{"const":1,"title":"Schema Version","type":"integer"}},"required":["schema_version","job_id","attachment_id","attachment_sha256","artifact_proposal_key","logparse_tool_ref","request_sha256"],"title":"LogparseParseClaim","type":"object"}
