{"artifact_proposal_key":"logparse_run","attachment_id":"00000000-0000-0000-0000-000000000050","attachment_sha256":"2222222222222222222222222222222222222222222222222222222222222222","job_id":"00000000-0000-0000-0000-000000000011","logparse_tool_ref":{"content_hash":"ffffffffffffffffffffffffffffffffffffffffffffffffffffffffffffffff","id":"logparse","version":"1.0.0"},"request_sha256":"4444444444444444444444444444444444444444444444444444444444444444","schema_version":1}
